{
  "twin_id": "did:learntwin:student004",
  "owner_did": "did:learner:0xJkL123",
  "profile": {
    "full_name": "Huỳnh Quốc Khánh",
    "birth_year": 2005,
    "institution": "UIT",
    "program": "Cybersecurity",
    "enrollment_date": "2025-09-01"
  },
  "learning_state": {
    "progress": {
      "Network Security": 0.8,
      "Cryptography": 0.6
    },
    "checkpoint_history": [
      {
        "module": "Network Security",
        "completed_at": "2025-06-20",
        "tokenized": false,
        "nft_cid": null
      }
    ],
    "current_modules": [
      "Network Security",
      "Cryptography"
    ]
  },
  "skill_profile": {
    "programming_languages": {
      "Python": 0.8,
      "C": 0.6
    },
    "soft_skills": {
      "security_analysis": 0.8
    }
  },
  "interaction_logs": {
    "last_llm_session": "2025-06-20T10:00:00+07:00",
    "most_asked_topics": [
      "Python",
      "C"
    ],
    "preferred_learning_style": "code-first"
  }
}