{
  "twin_id": "did:learntwin:student005",
  "owner_did": "did:learner:0xMnO456",
  "profile": {
    "full_name": "Phạm Tấn Gia Quốc",
    "birth_year": 2005,
    "institution": "UIT",
    "program": "Cybersecurity",
    "enrollment_date": "2025-09-01"
  },
  "learning_state": {
    "progress": {
      "Ethical Hacking": 0.75,
      "Digital Forensics": 0.8
    },
    "checkpoint_history": [
      {
        "module": "Ethical Hacking",
        "completed_at": "2025-06-20",
        "tokenized": false,
        "nft_cid": null
      }
    ],
    "current_modules": [
      "Ethical Hacking",
      "Digital Forensics"
    ]
  },
  "skill_profile": {
    "programming_languages": {
      "Python": 0.7,
      "Bash": 0.6
    },
    "soft_skills": {
      "penetration_testing": 0.8
    }
  },
  "interaction_logs": {
    "last_llm_session": "2025-06-20T10:00:00+07:00",
    "most_asked_topics": [
      "Python",
      "Bash"
    ],
    "preferred_learning_style": "code-first"
  }
}