{
  "twin_id": "did:learntwin:student006",
  "owner_did": "did:learner:0xPqR789",
  "profile": {
    "full_name": "Nguyá»…n Anh Khoa",
    "birth_year": 2005,
    "institution": "UIT",
    "program": "Computer Science",
    "enrollment_date": "2025-09-01"
  },
  "learning_state": {
    "progress": {
      "Introduction to Programming": 0.9,
      "Data Structures": 0.7
    },
    "checkpoint_history": [
      {
        "module": "Introduction to Programming",
        "completed_at": "2025-06-20",
        "tokenized": false,
        "nft_cid": null
      }
    ],
    "current_modules": [
      "Introduction to Programming",
      "Data Structures"
    ]
  },
  "skill_profile": {
    "programming_languages": {
      "Python": 0.8,
      "Java": 0.7
    },
    "soft_skills": {
      "problem_solving": 0.9
    }
  },
  "interaction_logs": {
    "last_llm_session": "2025-06-20T10:00:00+07:00",
    "most_asked_topics": [
      "Python",
      "Java"
    ],
    "preferred_learning_style": "code-first"
  }
}